{"type":"config","name":"FlySoar founder-fit research dossier","metricName":"evidence_items","metricUnit":"","bestDirection":"higher"}
{"run":1,"commit":"baselin","metric":0,"metrics":{"source_urls":0,"sections_complete":0,"local_fit_signals":0},"status":"crash","description":"Baseline measurement crashed due to fragile measure script on empty files","timestamp":1782253192590,"segment":0,"confidence":null,"asi":{"hypothesis":"Initialize evidence-count metric for research dossier","rollback_reason":"measure.sh failed before producing metrics, likely grep/awk/set -e interaction on empty files","next_action_hint":"Make measure.sh robust with explicit zero defaults and no failing pipelines"}}
{"run":2,"commit":"fix1","metric":0,"metrics":{"source_urls":0,"sections_complete":0,"local_fit_signals":0},"status":"crash","description":"Measure script still crashed because research directory was absent after revert","timestamp":1782253208240,"segment":0,"confidence":null,"asi":{"hypothesis":"Robust empty baseline measurement after prior crash","rollback_reason":"research/ directory was reverted/absent; touch could not create nested file","next_action_hint":"Add mkdir -p research at the start of .auto/measure.sh"}}
{"run":3,"commit":"fix2","metric":0,"metrics":{"source_urls":0,"sections_complete":0,"local_fit_signals":0},"status":"crash","description":"Measure script continued failing without visible output","timestamp":1782253217242,"segment":0,"confidence":null,"asi":{"hypothesis":"Add directory creation for empty baseline","rollback_reason":"Still exits nonzero, likely set -e with grep pipeline in source_urls command when no URLs exist","next_action_hint":"Temporarily run bash -x or rewrite measure.sh to avoid failing pipelines entirely"}}
{"run":4,"commit":"efd2451","metric":0,"metrics":{"source_urls":0,"sections_complete":0,"local_fit_signals":0},"status":"keep","description":"Established robust empty baseline for FlySoar research completeness metric","timestamp":1782253234241,"segment":0,"confidence":null,"asi":{"hypothesis":"A simple evidence-count script can guide iterative public/local research without incentivizing fabricated claims","next_action_hint":"Gather public sources from flysoar.ai, search engines, social profiles, company databases, then write cited dossier sections"}}
{"run":5,"commit":"774ccb9","metric":69,"metrics":{"source_urls":10,"sections_complete":5,"local_fit_signals":11},"status":"keep","description":"Built first cited FlySoar dossier covering product, tech, founder, funding caveats, competitors, fit, and outreach","timestamp":1782253529668,"segment":0,"confidence":null,"asi":{"hypothesis":"A source-cited dossier with local fit signals will maximize usefulness for founder outreach more than generic company research","public_findings":["Soar is a live Next.js flight-booking product with Duffel, Stripe-like billing, Twilio/verification, passkeys, analytics, friends/invites, and shareable offer/deal URLs visible from public sources","Henry's public X profile links to Soar, says he is 18 and making fun products, and shows speed/internal-tools/hiring preferences from tweets","No credible public funding record found in quick search; funding should be presented as undisclosed rather than bootstrapped"],"local_fit_findings":["Tailorec maps strongly to Soar needs: Next.js/FastAPI, complex external workflows, agent/browser automation, analytics, AWS ops","OS-from-scratch and production traffic metrics are strong proof points for a young speed-biased founder"],"next_action_hint":"Improve weak sections_complete by normalizing headings, add direct competitor comparison table, enrich Henry achievements from more public sources, and add a sharper 3-project proposal"}}
{"run":6,"commit":"d3067ff","metric":70,"metrics":{"source_urls":10,"sections_complete":7,"local_fit_signals":11},"status":"keep","description":"Normalized dossier headings and added a sourced outreach section so completeness checks cover all required areas","timestamp":1782253543754,"segment":0,"confidence":null,"asi":{"hypothesis":"The first dossier had all content but weak heading/source structure; normalizing sections improves navigability without changing factual claims","next_action_hint":"Add a competitor comparison table with URLs and a more concrete 3-project founding-engineer proposal"}}
{"run":7,"commit":"6abb9aa","metric":74,"metrics":{"source_urls":19,"sections_complete":7,"local_fit_signals":11},"status":"keep","description":"Expanded competitor landscape with canonical URLs and sharper positioning contrasts","timestamp":1782253560890,"segment":0,"confidence":74,"asi":{"hypothesis":"Founder outreach will be more impressive if it names competitors precisely and frames Soar's likely wedge against each","competitor_wedge":"Soar should avoid OTA breadth/loyalty wars and emphasize social deal links, mobile-web speed, and one-tap booking UX","next_action_hint":"Add concrete 30/60/90-day founding engineer plan tied to Henry's internal-tools and growth-loop preferences"}}
{"run":8,"commit":"1ed3bf8","metric":80,"metrics":{"source_urls":19,"sections_complete":7,"local_fit_signals":11},"status":"keep","description":"Added a concrete 30/60/90-day founding-engineer plan tied to Soar's visible architecture and Henry's internal-tools bias","timestamp":1782253584233,"segment":0,"confidence":32,"asi":{"hypothesis":"A specific 30/60/90 plan will convert research into an actionable reason Henry should talk to Faishal","proposal_themes":["growth funnel instrumentation","internal booking/support tools","booking state-machine reliability","share-card deal experiments","post-booking trust features","privacy/security hardening"],"next_action_hint":"Investigate more Henry/Cal AI public achievements and add a concise founder psychology / conversation strategy section"}}
{"run":9,"commit":"d48b279","metric":84,"metrics":{"source_urls":19,"sections_complete":7,"local_fit_signals":11},"status":"keep","description":"Added more nuanced founder achievement and operating-style signals from Henry's public X history","timestamp":1782253624976,"segment":0,"confidence":16.8,"asi":{"hypothesis":"Founder-specific observations about app charting, internal tools, offline sync, paywall tests, and SwiftUI hiring create better rapport than generic founder bio","founder_signals":["mobile app distribution/App Store charting","internal tools as growth leverage","stable backend instincts","paywall experimentation","SwiftUI/app studio hiring"],"next_action_hint":"Add a compact final cheat-sheet section so the user can act quickly without reading the full dossier"}}
{"run":10,"commit":"f21a0b0","metric":91,"metrics":{"source_urls":19,"sections_complete":7,"local_fit_signals":13},"status":"keep","description":"Added a compact action-oriented cheat sheet for quick founder conversation prep","timestamp":1782253642601,"segment":0,"confidence":13,"asi":{"hypothesis":"The user needs an immediately usable summary in addition to the detailed dossier to impress Henry in a real conversation","cheat_sheet_includes":["one-line product read","one-line tech read","one-line founder read","fit positioning","conversation opener","proof points","diagnostic question"],"next_action_hint":"Potential next improvement: produce a standalone email/DM and a 5-minute call script, but avoid overcounting low-quality bullets"}}
{"run":11,"commit":"6f847d6","metric":100,"metrics":{"source_urls":19,"sections_complete":7,"local_fit_signals":15},"status":"keep","description":"Added a sourced five-minute founder call script converting the dossier into an interview-ready narrative","timestamp":1782253682892,"segment":0,"confidence":10,"asi":{"hypothesis":"The most promising next improvement is not more raw research but converting existing evidence into a concise call script Faishal can use live with Henry","what_improved":["call opener grounded in public route analysis","founder-specific internal-tools hook","product insight about X deal-link distribution","engineering insight about Duffel workflow reliability","fit proof from Tailorec and OS project","diagnostic questions for discovering Henry's current bottleneck"],"next_action_hint":"Next iteration should either add a tiny technical teardown/prototype plan Henry could receive as a follow-up, or update .auto/prompt.md with tried experiments to preserve state."}}
{"run":12,"commit":"e02845a","metric":110,"metrics":{"source_urls":19,"sections_complete":7,"local_fit_signals":18},"status":"keep","description":"Added a concrete follow-up teardown/prototype plan and updated persisted autoresearch state","timestamp":1782253734646,"segment":0,"confidence":10.476190476190476,"asi":{"hypothesis":"The most promising next step is a tangible follow-up artifact Henry could receive after first contact, proving ownership and technical judgment without requiring private access","what_improved":["one-page teardown outline","public funnel diagram plan","booking state-machine names","internal console MVP tabs","idempotency/retry focus for booking endpoints","metric tree","explicit caveat against pretending private backend knowledge","three prototype options tied to Faishal's evidence"],"quality_guardrail":"All added claims are grounded in public routes/legal pages or local user-owned evidence; no private backend access or invented funding/founder facts were added.","next_action_hint":"Next iteration can write a standalone polished one-page teardown in research/henry_followup_teardown.md and cite the same sources, or create a shorter DM/email variant for first contact."}}
{"run":13,"commit":"ec8c9ff","metric":116,"metrics":{"source_urls":19,"sections_complete":7,"local_fit_signals":18},"status":"keep","description":"Created a standalone follow-up teardown artifact and summarized its sourced value in the dossier","timestamp":1782253778483,"segment":0,"confidence":8.285714285714286,"asi":{"hypothesis":"A polished one-page teardown gives Faishal a concrete artifact to send Henry after first contact, increasing perceived founder-engineer readiness beyond generic research","what_improved":["new research/henry_followup_teardown.md artifact","funnel from X deal post to ticket/result/support","booking state machine to validate","internal console MVP tabs","metric tree separating activation/intent/conversion/trust/growth","explicit public-signal caveat to avoid overclaiming"],"quality_guardrail":"The standalone artifact is framed as a public-signal teardown and not a claim of private Soar architecture knowledge; dossier metric improved via a summary section with real references, not duplicated filler.","next_action_hint":"Next iteration should add a very short first-contact DM/email variant optimized for Henry's speed/internal-tools preferences, or improve source coverage if new public company/funding data appears."}}
{"run":14,"commit":"952e9e3","metric":121,"metrics":{"source_urls":19,"sections_complete":7,"local_fit_signals":19},"status":"keep","description":"Added channel-specific first-contact message variants and summarized their sourced rationale in the dossier","timestamp":1782253817697,"segment":0,"confidence":7.806451612903226,"asi":{"hypothesis":"A concise set of channel-specific messages is the most actionable next artifact because Henry is speed-biased and likely responds better to a sharp, short pitch than a long dossier","what_improved":["new research/first_contact_messages.md","X/DM variant","email/LinkedIn variant","short answer to 'what would you build?'","short answer to 'why you?'","dossier section tying each variant to public/product/local evidence"],"quality_guardrail":"Messages reuse already verified public and local evidence; no new speculative facts or funding claims were introduced.","next_action_hint":"Next iteration can improve personalization by adding a short objection-handling section for likely founder concerns: location/timezone, lack of travel-domain experience, comp, proof of speed, and what to ship in 48 hours."}}
{"run":15,"commit":"8921824","metric":127,"metrics":{"source_urls":19,"sections_complete":7,"local_fit_signals":21},"status":"keep","description":"Added founder objection-handling answers and tied them to sourced product/local evidence","timestamp":1782253860193,"segment":0,"confidence":6.684210526315789,"asi":{"hypothesis":"Likely objections are now the highest-leverage gap: a founder may challenge travel-domain experience, production trust, speed, or overreach, so concise prepared answers improve interview conversion","what_improved":["new research/objection_handling.md","answers for travel-domain gap","production trust ramp-up answer","48-hour shipping proof answer","response if Soar already has internal tools","anti-overclaiming answer for public-route analysis","desired role framing"],"quality_guardrail":"This iteration improves practical readiness using existing verified evidence and explicit caveats, rather than adding speculative company claims or low-quality source count padding.","next_action_hint":"Next iteration should consider improving the measurement script to count standalone artifact evidence too, or update .auto/prompt.md tried list; primary dossier remains the canonical scored file."}}
{"run":16,"commit":"45fcdc4","metric":134,"metrics":{"source_urls":19,"sections_complete":7,"local_fit_signals":23},"status":"keep","description":"Added a 48-hour work-trial plan and refreshed persisted autoresearch state","timestamp":1782253903519,"segment":0,"confidence":6.380952380952381,"asi":{"hypothesis":"A founder may be more persuaded by a concrete low-risk work-trial offer than by more research; a 48-hour plan converts evidence into a practical audition","what_improved":["narrow non-invasive 48-hour artifact framing","hour-by-hour plan from bottleneck alignment to schema, fake-data console, implementation memo, and walkthrough","explicit no-private-access posture","maps trial to Soar public route/legal/privacy signals","ties credibility to Tailorec demonstrated work"],"quality_guardrail":"This adds actionable founder-facing substance grounded in existing evidence, not speculative claims or benchmark padding; .auto/prompt.md was updated to preserve tried-state for future iterations.","next_action_hint":"Next iteration should add a one-page resume/portfolio positioning section or polish final artifacts; avoid bloating the dossier if no new high-quality evidence is available."}}
{"run":17,"commit":"a6afe97","metric":142,"metrics":{"source_urls":19,"sections_complete":7,"local_fit_signals":29},"status":"keep","description":"Added a portfolio positioning artifact and sourced Soar-specific proof stack to the dossier","timestamp":1782253958879,"segment":0,"confidence":6.761904761904762,"asi":{"hypothesis":"After outreach and objection handling, the biggest remaining conversion gap is a concise portfolio narrative that maps Faishal's evidence to Soar's actual needs without sounding generic","what_improved":["new research/portfolio_positioning.md","headline positioning around growth, booking reliability, internal tools, analytics, and ops","Tailorec proof stack mapped to Soar workflow risk","analytics proof mapped to deal-link funnel","AWS/runbook proof mapped to production ownership","OS proof framed as supporting systems depth","warning not to pitch as generic AI engineer"],"quality_guardrail":"This iteration adds local-evidence-backed positioning rather than new speculative public claims; it improves personalization and avoids overfitting by creating a genuinely usable artifact.","next_action_hint":"Next iteration can polish final delivery with an index/README linking the artifacts and recommended order of use, or improve public source coverage only if new credible sources are found."}}
{"run":18,"commit":"1995f17","metric":147,"metrics":{"source_urls":19,"sections_complete":7,"local_fit_signals":29},"status":"keep","description":"Added an outreach package index and updated persisted state for artifact usage order","timestamp":1782254004955,"segment":0,"confidence":6.25531914893617,"asi":{"hypothesis":"The research package is now broad enough that the highest-leverage improvement is usability: a clear index prevents sending too much and guides the user through DM, teardown, work-trial, and portfolio proof in the right order","what_improved":["new research/README.md","recommended order of use across all artifacts","warning not to send the full dossier first","best current pitch distilled","evidence-boundary reminder","updated .auto/prompt.md tried-state"],"quality_guardrail":"This improves practical delivery and reduces risk of over-sharing; added dossier evidence references real artifacts/public sources rather than padding with new speculative claims.","next_action_hint":"Future iterations should prefer polishing/reducing friction or finding genuinely new public facts; avoid expanding the dossier unless the added content changes outreach behavior."}}
{"run":19,"commit":"1273d1c","metric":153,"metrics":{"source_urls":19,"sections_complete":7,"local_fit_signals":30},"status":"keep","description":"Added a pre-send checklist to reduce outreach mistakes and summarized it with sourced rationale in the dossier","timestamp":1782254045877,"segment":0,"confidence":5.884615384615385,"asi":{"hypothesis":"The highest-leverage next improvement is reducing execution risk at send time: a checklist prevents over-sending, overclaiming, stale-profile mistakes, and creepy phrasing while preserving the strong pitch","what_improved":["new research/send_checklist.md","current-site/profile verification step","single-channel and no-attachment guidance","non-creepy public-signal phrasing","first-message success criteria","restrained follow-up cadence"],"quality_guardrail":"This is practical polish tied to existing evidence and outreach behavior; it does not invent new facts or optimize only for metric count.","next_action_hint":"Future iterations should only add genuinely useful final-delivery polish or seek new public facts; consider final artifact review for contradictions and overlong sections."}}
{"run":20,"commit":"0883a22","metric":159,"metrics":{"source_urls":19,"sections_complete":7,"local_fit_signals":31},"status":"keep","description":"Added credibility guardrails to prevent overclaiming and make the outreach safer to send","timestamp":1782254086722,"segment":0,"confidence":5.482758620689655,"asi":{"hypothesis":"At this mature stage, reducing downside risk matters more than adding more facts; credibility guardrails prevent creepy reverse-engineering language, funding overclaims, generic AI pitching, and exposure of private local notes","what_improved":["new research/credibility_guardrails.md","safe phrasing for public-signal hypotheses","funding-status caution","reverse-engineering phrasing caution","generic AI positioning warning","do-not-send-local-notes warning","safe default caveat sentence"],"quality_guardrail":"This iteration improves truthfulness and outreach safety using existing sourced evidence; it explicitly reduces overclaiming instead of adding speculative content.","next_action_hint":"Next iteration should likely do a consistency pass for contradictions or create a final minimal sending pack; avoid new sections unless they reduce risk or improve actionability."}}
{"run":21,"commit":"bbb07ae","metric":165,"metrics":{"source_urls":19,"sections_complete":7,"local_fit_signals":32},"status":"keep","description":"Added a minimal send pack that distills the outreach into the shortest actionable sequence","timestamp":1782254128600,"segment":0,"confidence":5.32258064516129,"asi":{"hypothesis":"The package is now extensive, so the highest-leverage improvement is a minimal operational send pack that prevents analysis paralysis and gives Faishal exactly what to send/say next","what_improved":["new research/minimal_send_pack.md","first DM","follow-up if Henry asks for teardown","answer for what would you ship","answer for why you","stop rule to avoid needy follow-up"],"quality_guardrail":"This is a distillation and execution aid grounded in prior sourced evidence; it avoids inventing new claims and reduces the risk of over-sending the full dossier.","next_action_hint":"Future iterations should prioritize consistency review or genuinely new public source discovery; the core outreach kit is now action-ready."}}
{"run":22,"commit":"ba0f0b9","metric":171,"metrics":{"source_urls":19,"sections_complete":7,"local_fit_signals":33},"status":"keep","description":"Added a consistency review and corrected funding wording to avoid implying bootstrapped status","timestamp":1782254176767,"segment":0,"confidence":5.428571428571429,"asi":{"hypothesis":"A contradiction/overclaim safety pass is the most valuable next iteration because the package is mature and outreach risk now comes from wording mistakes more than missing content","what_improved":["new research/consistency_review.md","fixed funding wording from bootstrapped/undisclosed to undisclosed only","confirmed Duffel is explicitly source-backed","reaffirmed public client-route claims are hypotheses/visible surfaces","preserved safest technical caveat","reinforced not sending raw local notes"],"quality_guardrail":"This iteration actively reduced overclaiming and corrected a contradiction discovered by searching the research package; the metric improvement came from documenting real safety checks, not padding with unrelated facts.","next_action_hint":"Future iterations should continue with contradiction/readability audits or stop expanding unless new credible public data appears."}}
