{"run":23,"commit":"bb81cbb","metric":177,"metrics":{"source_urls":19,"sections_complete":7,"local_fit_signals":33},"status":"keep","description":"Added high-signal discovery questions to guide a real conversation with Henry","timestamp":1782254223654,"segment":0,"confidence":5.53125,"asi":{"hypothesis":"The next highest-leverage artifact is a concise question bank so Faishal can diagnose Henry's actual bottleneck instead of over-presenting research","what_improved":["new research/questions_for_henry.md","product/growth questions around deal-link funnel and retention","booking reliability questions around ambiguous states","internal tooling questions around support/fraud/payment/Duffel visibility","founder/team fit questions around first-month value and cracked-engineer definition","best three-question sequence for short calls"],"quality_guardrail":"Questions are grounded in existing public/product evidence and improve conversation quality; they avoid new factual claims and encourage validation with Henry rather than assuming private details.","next_action_hint":"Future iterations should do readability/contradiction review or genuinely new public source discovery; core outreach artifacts are now comprehensive."}}
{"run":24,"commit":"94b0942","metric":183,"metrics":{"source_urls":19,"sections_complete":7,"local_fit_signals":34},"status":"keep","description":"Added a 15-minute call agenda that turns the research into a founder-centered conversation structure","timestamp":1782254270817,"segment":0,"confidence":5.382352941176471,"asi":{"hypothesis":"If Henry agrees to a call, a tight agenda is more valuable than more background: it keeps Faishal from monologuing and steers toward bottleneck discovery plus a concrete 48-hour artifact","what_improved":["new research/call_agenda.md","public-signal caveated opener","bottleneck-first question","mapping from answer to ownership slice","selective proof strategy","clear close asking which artifact to build"],"quality_guardrail":"This improves conversation execution using already sourced evidence and explicitly discourages reciting the full dossier or claiming private backend knowledge.","next_action_hint":"Future iterations should focus on final readability/contradiction review or real new public source discovery; avoid further expansion unless it changes outreach behavior."}}
{"run":25,"commit":"6ab67ce","metric":189,"metrics":{"source_urls":19,"sections_complete":7,"local_fit_signals":34},"status":"keep","description":"Added a source confidence map to calibrate which claims can be stated directly versus as hypotheses","timestamp":1782254315478,"segment":0,"confidence":5.25,"asi":{"hypothesis":"At this stage the most valuable improvement is claim calibration: separating facts, inferences, and unknowns reduces overclaiming risk while preserving strong founder-facing insights","what_improved":["new research/source_confidence.md","high-confidence public facts","medium-confidence public-signal inferences","unknowns not to claim","clear phrasing rule for is/appears/unknown"],"quality_guardrail":"This iteration improves epistemic hygiene and outreach truthfulness; it does not add speculative claims and explicitly marks uncertain areas as unknown.","next_action_hint":"Future iterations should focus on readability/contradiction audits or actual new public facts; avoid expanding content merely to increase counts."}}
{"run":26,"commit":"77be553","metric":192,"metrics":{"source_urls":20,"sections_complete":7,"local_fit_signals":34},"status":"keep","description":"Added PWA manifest evidence to strengthen the mobile-web/installable-app product read","timestamp":1782254359871,"segment":0,"confidence":5.1891891891891895,"asi":{"hypothesis":"A genuinely new public source (manifest.json) can improve product understanding more safely than adding more outreach prose; it directly substantiates the mobile-web/PWA thesis","what_improved":["added manifest.json source to sources.md","added product evidence for standalone display, start_url, app name, theme/background, icons, and description","added technical evidence for manifest/icon links in HTML"],"quality_guardrail":"This iteration uses a new public source and strengthens an existing claim; it does not invent private architecture or pad with generic outreach advice.","next_action_hint":"Future iterations should prefer similarly concrete new public sources or final readability audits; avoid further expansion without new evidence."}}
{"run":27,"commit":"a998ec3","metric":195,"metrics":{"source_urls":21,"sections_complete":7,"local_fit_signals":34},"status":"keep","description":"Added sitemap and robots.txt evidence to support active-site and public-access claims","timestamp":1782254419025,"segment":0,"confidence":5.27027027027027,"asi":{"hypothesis":"Concrete public infrastructure sources (sitemap/robots/manifest) improve source coverage and credibility more than more outreach prose at this stage","what_improved":["switched PWA citation to manifest.webmanifest","added sitemap evidence for daily home-page changefreq and recent lastmod","added robots.txt evidence that public crawling is allowed and sitemap is declared","updated sources.md"],"quality_guardrail":"This uses public allowed endpoints and strengthens factual claims about site freshness/public accessibility; no private scraping, bypassing, or speculative facts were added.","next_action_hint":"Future iterations should seek similarly concrete public sources or perform final readability/contradiction audits; avoid adding more outreach sections unless they change user behavior."}}
{"run":28,"commit":"eba19e6","metric":199,"metrics":{"source_urls":21,"sections_complete":7,"local_fit_signals":34},"status":"keep","description":"Added public response-header evidence for Next.js, Cloudflare, Render, and dynamic app behavior","timestamp":1782254460886,"segment":0,"confidence":5.1688311688311686,"asi":{"hypothesis":"Concrete response-header evidence can refine the technical architecture read more credibly than adding more speculative prose","what_improved":["confirmed Next.js via x-powered-by header","added Cloudflare edge/proxy signals from response headers","added Render origin-hosting signal from x-render-origin-server/rndr-id","noted dynamic no-store cache-control","updated architecture inference away from Vercel toward Render + Cloudflare"],"quality_guardrail":"This uses public HTTP headers from the allowed home page and corrects/refines a prior infrastructure inference; it does not claim private backend/database details.","next_action_hint":"Future iterations should continue correcting/refining with concrete public evidence or do readability audits; avoid broad speculative architecture claims."}}
{"run":29,"commit":"35829a1","metric":206,"metrics":{"source_urls":21,"sections_complete":7,"local_fit_signals":34},"status":"keep","description":"Added production validation questions to turn public-signal hypotheses into implementation-safe discovery","timestamp":1782254507505,"segment":0,"confidence":5.024390243902439,"asi":{"hypothesis":"After refining the architecture read, the next best artifact is a technical validation checklist that shows Faishal knows what must be confirmed before production work","what_improved":["new research/production_validation_questions.md","booking state questions","Duffel/provider boundary questions","payment and idempotency questions","verification/traveler data questions","support operations questions","growth instrumentation questions","security/privacy questions"],"quality_guardrail":"Questions are grounded in public routes, terms, privacy policy, and analytics signals while explicitly seeking validation instead of asserting private internals.","next_action_hint":"Future iterations can update .auto/prompt.md to include recent artifacts, or perform final readability/contradiction review; avoid adding generic sections without new behavioral value."}}
{"run":30,"commit":"f3770c6","metric":209,"metrics":{"source_urls":21,"sections_complete":7,"local_fit_signals":34},"status":"keep","description":"Added public Soar X profile distribution signals to strengthen the growth-loop read","timestamp":1782254553157,"segment":0,"confidence":5.036144578313253,"asi":{"hypothesis":"Soar's own X profile metadata is a concrete public source that strengthens the thesis that social/deal-link distribution is central to the company wedge","what_improved":["added Soar X follower/following/tweet/location/affiliate context","added public X account creation timing","connected new but active social presence to distribution priority"],"quality_guardrail":"These are public X profile signals and are framed as distribution context, not private traction or revenue claims; follower counts are marked as capture-time values.","next_action_hint":"Future iterations should either find similarly concrete public signals or focus on final audit/polish; avoid overstating social follower count as product traction."}}
{"run":31,"commit":"b6f0611","metric":214,"metrics":{"source_urls":22,"sections_complete":7,"local_fit_signals":34},"status":"keep","description":"Added a WhatsApp recovery message tailored to the actual missed scheduling context","timestamp":1782261821615,"segment":0,"confidence":5.095238095238095,"asi":{"hypothesis":"The real current bottleneck is no longer generic outreach but recovering an already-warm WhatsApp thread after a delayed/declined scheduling reply; a tailored message maximizes response odds","what_improved":["new research/whatsapp_recovery_message.md","takes ownership for delay without over-apologizing","uses Henry's cracked developer framing","shows Soar-specific research and deep interest","mentions Emergent only as context while prioritizing Soar","offers quick 15-minute call or short teardown","asks for concrete availability"],"quality_guardrail":"The message is based on user-provided WhatsApp context and existing sourced Soar research; it avoids pressure tactics, fake urgency, and overclaiming private knowledge.","next_action_hint":"User should send a concise version with 2-3 concrete windows in Henry's timezone; future iteration could tailor exact time windows once user's availability/timezone are known."}}
